{
  "schema_version": "2.0-rc1",
  "issue_id": "2026-W33",
  "route": "WEEKLY_GENERATED_V2",
  "status": "ESTABLISHED",
  "production_state_basis": {
    "path": "sources/2026-W33/production-state.json",
    "historical_sha256": "b73653aad29de554612bf188a75f8ba8d989f84cdbdfed0acba27d4e4534e55d",
    "lifecycle_state": "DRAFT_COMPLETE"
  },
  "accepted_refs": [
    {
      "name": "candidate-matrix",
      "path": "sources/2026-W33/candidate-matrix-v2.json",
      "sha256": "eb7a56e94835437a565d0d027e4c6d04a0bfde780841f6f01289d70de9ff7194"
    },
    {
      "name": "discovery-acceptance",
      "path": "sources/2026-W33/discovery/discovery-accepted-v2.json",
      "sha256": "717441fddc6a7111131527e40825a7b088cb2a0af966976b99d01f2be9846942"
    },
    {
      "name": "draft-package:pkg-core",
      "path": "sources/2026-W33/draft/v2/packages/pkg-core/draft-package.json",
      "sha256": "f50ac6a0a99b29d02989de75c8e46c510f175061903eecb92caaf370d2700fbd"
    },
    {
      "name": "draft-result:pkg-core",
      "path": "sources/2026-W33/draft/v2/packages/pkg-core/draft-result.json",
      "sha256": "1b3a40dc0625f94cb23fd4314e667b289b09a60c056b9a28632b633401d5592a"
    },
    {
      "name": "evidence-acceptance",
      "path": "sources/2026-W33/research/v2/acceptance-revisions/rev-full-weekly-full-edstaged-v2/candidate/evidence-runs/3d8de013ee3e0e8f88a412bdf27c226795db7df8ab49d3b1a8eeb9e84a4afb7f/evidence-accepted.json",
      "sha256": "e59a2ea7e34b5d66e2be5cb4ee64d46ab8b5663a3d4dfb9e5e05d2d4b860be66"
    },
    {
      "name": "evidence-card:evidence:2026-W33:2556cd0b7e345984",
      "path": "sources/2026-W33/research/v2/acceptance-revisions/rev-full-weekly-full-edstaged-v2/candidate/evidence-runs/3d8de013ee3e0e8f88a412bdf27c226795db7df8ab49d3b1a8eeb9e84a4afb7f/results/task-b88ddbae08f8b55d551d.json",
      "sha256": "82e84d24a7c5afbdfaf530da144ea953edfd9271e26fe23e90437a1a6eeffabd"
    },
    {
      "name": "issue-architecture",
      "path": "sources/2026-W33/architecture-v2.json",
      "sha256": "96cff93761b3c6047e9409652ceddb0bf9da2fed3e19fbecbe8d96e85bf9a32c"
    },
    {
      "name": "materiality-ledger",
      "path": "sources/2026-W33/research/v2/acceptance-revisions/rev-full-weekly-full-edstaged-v2/candidate/materiality-ledger.json",
      "sha256": "86c458714bea1bac9d641289b6f233277a8db567e061b34429c3f5958264c8f8"
    },
    {
      "name": "production-profile",
      "path": "sources/2026-W33/production-profile.json",
      "sha256": "3cf51172cc1d8b80a0d7551202b31d5312f45a5258412c766dfd1eaf410e8066"
    },
    {
      "name": "synthesis-input",
      "path": "sources/2026-W33/draft/v2/profile-synthesis-input.json",
      "sha256": "0912db03039533e1a836d79d9f0cd775c0bbedc64d926e704900c98c8927b8e9"
    },
    {
      "name": "synthesis-result",
      "path": "sources/2026-W33/draft/v2/profile-synthesis-result.json",
      "sha256": "11b067b70ba7d8a0d628d9edfe3f5e1f04a590899836d2cd330cfa6f42b54f4a"
    }
  ],
  "authored_refs": [
    {
      "name": "publication-semantic-input",
      "path": "sources/2026-W33/publication/v2/interactive-semantic-publication-input.json",
      "sha256": "5327bb263d4049e815818a1363d3034eebcdf636c83741f009ca9cf1a23378ed"
    },
    {
      "name": "drafting-authored-archive",
      "path": "sources/2026-W33/draft/v2/interactive-drafting-synthesis-input.json",
      "sha256": "5ba34ab397d9ce28d56f7a6e22d800001f499f74f32304763093dc65be9532bd"
    }
  ],
  "reviewed_reader_input": {
    "path": "sources/2026-W33/publication/v2/reader-surface-input-v2.json",
    "sha256": "1362e357352dee15ad9c342fe9105357d082f47c7f117f7863307fcb2307844f"
  },
  "semantic_review": {
    "path": "sources/2026-W33/publication/v2/reader-surface-semantic-review-v2.json",
    "sha256": "e753f30598c810ce75ac64e81dbaaddd6f185326fbc99bd2cb7c555b517dad68"
  },
  "current_tools": {
    "repository_commit_sha": "66bb441cf4f4af47d08bba0d5d85690a32e09a7e",
    "contract": {
      "pipeline_contract_version": "2.0-rc1",
      "pipeline_contract_sha256": "3adfbda22131eac4017ef867aef2ebb2f346f884731c4ea8343e9062392eabd5",
      "quality_contract_version": "2.0-rc1",
      "quality_contract_sha256": "b5b955d524fb438c0f1b2c9490bea1da2083e79028d67a55ca424bbfc20f2958",
      "research_profile_version": "2.0-rc1",
      "research_profile_sha256": "666f8a064b190ffd35216e26d6fdf2dd0fa932cac7b1b0d6448e262ded77b9a8",
      "publication_profile_version": "2.0-rc1",
      "publication_profile_sha256": "99adff93ff443e02bdcce639ce5fc4d4c959ee45a804da70efc4277db57fdddb"
    },
    "closure": [
      {
        "name": ".latexmkrc",
        "path": ".latexmkrc",
        "sha256": "18199fd85e3e3c46ede9322a709e4f64e39470f69c6c20935e598d4c08adbc26"
      },
      {
        "name": "schemas/dm022-preadoption-report-v2.schema.json",
        "path": "schemas/dm022-preadoption-report-v2.schema.json",
        "sha256": "10238a1af7330e5352cbbad709e6360797fade789f184126f296fbeb3e82e4db"
      },
      {
        "name": "schemas/dm022-revision-manifest-v2.schema.json",
        "path": "schemas/dm022-revision-manifest-v2.schema.json",
        "sha256": "e7534d019ec1b58672ff306ac901d65669e2c64251fe41964df2e81e356fbaf4"
      },
      {
        "name": "schemas/dm022-revision-proof-v2.schema.json",
        "path": "schemas/dm022-revision-proof-v2.schema.json",
        "sha256": "a79c09209c145d485ec39e1c1c277f0d706cf3ccfb0972c5bd9f6d6fe7cec5c3"
      },
      {
        "name": "schemas/dm022-revision-request-v2.schema.json",
        "path": "schemas/dm022-revision-request-v2.schema.json",
        "sha256": "a99f0dc1f6e10ae5736063a051ef3b147eb85bccf20e435db87054a2bac1a31f"
      },
      {
        "name": "schemas/dm022-supersession-checkpoint-v2.schema.json",
        "path": "schemas/dm022-supersession-checkpoint-v2.schema.json",
        "sha256": "fd39c246617293ecb6760906534512e2b5a14a484916c3d1f3ba055b33d3bec0"
      },
      {
        "name": "schemas/editorial-manuscript-spec-v2.schema.json",
        "path": "schemas/editorial-manuscript-spec-v2.schema.json",
        "sha256": "043ce8a565385549265d6666642c2e3ec8ce0d8e8e5544a7eddfb32691478250"
      },
      {
        "name": "schemas/editorial-publication-build-record-v2.schema.json",
        "path": "schemas/editorial-publication-build-record-v2.schema.json",
        "sha256": "b7c82476047373995cd5c4733ce2ba0b1c53fef72a84bceb26feec9078fea4ba"
      },
      {
        "name": "schemas/editorial-publication-set-v2.schema.json",
        "path": "schemas/editorial-publication-set-v2.schema.json",
        "sha256": "7beebcef48d7777144f7df7ce3fddc27c0d39df685fdc49cbfdd7d798c7e61e9"
      },
      {
        "name": "schemas/editorial-publication-source-manifest-v2.schema.json",
        "path": "schemas/editorial-publication-source-manifest-v2.schema.json",
        "sha256": "494a1d152c76bca810d30e743d567210f130cb4197561d82b276f24ef69441bc"
      },
      {
        "name": "schemas/editorial-toolchain-spec-v2.schema.json",
        "path": "schemas/editorial-toolchain-spec-v2.schema.json",
        "sha256": "50b5dc3ee05c496b2c2da13377c5ee0a883dfb52d9b9785189cb00a75d6e4db4"
      },
      {
        "name": "schemas/publication-candidate-v2.schema.json",
        "path": "schemas/publication-candidate-v2.schema.json",
        "sha256": "a3fe0bc8dc21f79668e7017914f1e14b8933e1fb1cd7826c3a6515e01b42ed59"
      },
      {
        "name": "schemas/publication-surface-revalidation.schema.json",
        "path": "schemas/publication-surface-revalidation.schema.json",
        "sha256": "0376c7b43941c6b99d699996372572e04e9b4c98f495e5a5e3287163f37b23a5"
      },
      {
        "name": "schemas/quality-regression-bundle-v2.schema.json",
        "path": "schemas/quality-regression-bundle-v2.schema.json",
        "sha256": "3aaf17255baba111d9f96dce2c90640380a38dbd691b82ac838eb7a33392c2bf"
      },
      {
        "name": "schemas/reader-manuscript-v2.schema.json",
        "path": "schemas/reader-manuscript-v2.schema.json",
        "sha256": "426f5a3689e2bc2829138893a8a28f0fc1fc6e696d373419a49f5cf16e8bb4f3"
      },
      {
        "name": "schemas/reader-surface-gate-v2.schema.json",
        "path": "schemas/reader-surface-gate-v2.schema.json",
        "sha256": "a734235caab222d30e78e2fea17f3a376d101368c482ec8d91371a1d7bb81f4b"
      },
      {
        "name": "schemas/reader-surface-input-v2.schema.json",
        "path": "schemas/reader-surface-input-v2.schema.json",
        "sha256": "8db11d4eb0dfa1a0c66beeab6ef5ad0b7008bda88f72a3e16df13a17dea4289c"
      },
      {
        "name": "schemas/versioned-renewal-basis-v2.schema.json",
        "path": "schemas/versioned-renewal-basis-v2.schema.json",
        "sha256": "76f77ee552ef430756d7acd9c8f6d780c1d7d4ac12aca976b49cd552914c4aad"
      },
      {
        "name": "schemas/versioned-renewal-publication-set-v2.schema.json",
        "path": "schemas/versioned-renewal-publication-set-v2.schema.json",
        "sha256": "a7594e63db178016038787307c54f680d4cef53020577676ac1aaa7e2e739354"
      },
      {
        "name": "schemas/versioned-renewal-source-manifest-v2.schema.json",
        "path": "schemas/versioned-renewal-source-manifest-v2.schema.json",
        "sha256": "9d58894ef8b60315c8e8405206d31764f10f4030b1e71ffdd870bf650cf28c42"
      },
      {
        "name": "schemas/versioned-renewal-source-proof-v2.schema.json",
        "path": "schemas/versioned-renewal-source-proof-v2.schema.json",
        "sha256": "4c6413ea243d8131589cced31c677167b94654f4cda118812704d3a69aa2f493"
      },
      {
        "name": "schemas/weekly-publication-source-manifest-v2.schema.json",
        "path": "schemas/weekly-publication-source-manifest-v2.schema.json",
        "sha256": "c11ad525c6f8dd2a8f9d68647a3675bbac6988e6cdace54762ce145143c3b578"
      },
      {
        "name": "scripts/render_article_draft_tex.py",
        "path": "scripts/render_article_draft_tex.py",
        "sha256": "9c64ebce313a09ffa1263b2437736e1459dcd2e97e41611bff5cd669d6c16328"
      },
      {